{
  "schemaVersion": "question-audit-review@1",
  "reviewerRef": "2222222222222222222222222222222222222222222222222222222222222222",
  "role": "reviewer",
  "labels": [
    { "questionId": "clean-question", "contentSha256": "aaaaaaaaaaaaaaaaaaaaaaaaaaaaaaaaaaaaaaaaaaaaaaaaaaaaaaaaaaaaaaaa", "flawCodes": [] },
    { "questionId": "wrong-key-question", "contentSha256": "bbbbbbbbbbbbbbbbbbbbbbbbbbbbbbbbbbbbbbbbbbbbbbbbbbbbbbbbbbbbbbbb", "flawCodes": ["WRONG_KEY_SUSPECTED"] }
  ]
}
